{
  "behavior_dimension_mapping": {
    "branching_error_behavior": [
      "branch"
    ],
    "cli_tooling": [
      "function"
    ],
    "generated_authority": [
      "artifact"
    ],
    "install_cache_package": [
      "artifact"
    ],
    "library_api": [
      "function"
    ],
    "product_ui_control_surface": [
      "ui_state"
    ],
    "security_trust_boundary": [
      "branch",
      "function"
    ],
    "workflow_orchestration": [
      "branch",
      "artifact"
    ]
  },
  "changed_file_coupling_policy": {
    "blocker_path": "VERIFICATION_BACKLOG.json",
    "changed_files": [
      ".codex-plugin/plugin.json",
      ".harness/coverage-command",
      ".harness/run-coverage.sh",
      "agents/orchestration-recovery-falsifier.md",
      "agents/product-simplicity-falsifier.md",
      "agents/security-trust-boundary-falsifier.md",
      "custom-agents/harness-orchestration-recovery-falsifier.toml",
      "custom-agents/harness-product-simplicity-falsifier.toml",
      "custom-agents/harness-security-trust-boundary-falsifier.toml",
      "docs/exec-plans/active/mandatory-product-fitness-quality-in-use-enforcement.md",
      "docs/foundational-law-traceability.json",
      "docs/law-family-aliases.json",
      "docs/mandatory-law-surfaces.json",
      "docs/namespace-class-registry.json",
      "docs/plugin-cohesion-manifest.json",
      "docs/source-obligation-matrix.json",
      "docs/source-obligation-matrix.md",
      "fixtures/law-surfaces/valid/memory-context-boundary-receipt.json",
      "fixtures/law-surfaces/valid/product-live-surface-receipt.json",
      "fixtures/mandatory-law-surfaces/valid/cli-control-plane-authority.json",
      "fixtures/mandatory-law-surfaces/valid/cli-performance-latency-speed-iteration-fitness.json",
      "fixtures/mandatory-law-surfaces/valid/cli-self-law-compliance.json",
      "fixtures/mandatory-law-surfaces/valid/validator-source-namespace-topology.json",
      "fixtures/namespace/valid/namespace-class-registry-valid.json",
      "fixtures/red/namespace-external-compatibility-authority-missing.json",
      "fixtures/red/namespace-generated-class-authority-missing.json",
      "fixtures/red/namespace-junk-drawer-path.json",
      "fixtures/red/namespace-law-present-only-as-prose.json",
      "fixtures/red/namespace-orphan-repo-file.json",
      "fixtures/red/namespace-repeated-prefix-without-subdirectory.json",
      "fixtures/red/namespace-root-clutter-without-route.json",
      "fixtures/red/namespace-vague-common-domain-path.json",
      "fixtures/red/namespace-validator-source-broad-glob-red.json",
      "fixtures/red/namespace-validator-source-class-waiver-manifest-contract-red.json",
      "fixtures/red/namespace-validator-source-coverage-wave-history-red.json",
      "fixtures/red/namespace-validator-source-error-not-hidden-by-other-proof-red.json",
      "fixtures/red/namespace-validator-source-generated-class-red.json",
      "fixtures/red/namespace-validator-source-iinternal-typo-red.json",
      "fixtures/red/namespace-validator-source-manifest-listing-cannot-bless-red.json",
      "fixtures/red/namespace-validator-source-partial-module-factoring-red.json",
      "fixtures/red/namespace-validator-source-top-level-internal-cluster-red.json",
      "fixtures/red/namespace-validator-source-top-level-internal-coverage-wave-red.json",
      "fixtures/red/namespace-validator-source-widened-class-tamper-red.json",
      "fixtures/red/review-round-product-fitness-claim-binding-missing.json",
      "fixtures/red/review-round-product-fitness-disposition-missing.json",
      "fixtures/red/review-round-product-fitness-disposition-stale.json",
      "fixtures/red/review-round-product-fitness-disposition-unowned.json",
      "fixtures/red/review-round-product-fitness-disposition-wrong-owner.json",
      "fixtures/red/review-round-product-fitness-fixture-substitution.json",
      "fixtures/red/review-round-product-fitness-four-person-no-disposition.json",
      "fixtures/red/review-round-product-fitness-generic-approval-substitution.json",
      "fixtures/red/review-round-product-fitness-happy-path-substitution.json",
      "fixtures/red/review-round-product-fitness-install-substitution.json",
      "fixtures/red/review-round-product-fitness-owner-missing.json",
      "fixtures/red/review-round-product-fitness-product-cohesion-substitution.json",
      "fixtures/red/review-round-product-fitness-receipt-digest-missing.json",
      "fixtures/red/review-round-product-fitness-receipt-only-substitution.json",
      "fixtures/red/review-round-product-fitness-required-flag-missing.json",
      "fixtures/red/review-round-product-fitness-reviewer-agreement-substitution.json",
      "fixtures/red/review-round-product-fitness-smoke-substitution.json",
      "fixtures/red/review-round-product-fitness-undeclared-fifth-reviewer.json",
      "fixtures/review-round/anchors/product-fitness-receipt.json",
      "fixtures/review-round/prompt-packets/product_simplicity_falsifier.md",
      "fixtures/review-round/reports/orchestration_recovery_falsifier.md",
      "fixtures/review-round/reports/product_simplicity_falsifier.md",
      "fixtures/review-round/reports/security_trust_boundary_falsifier.md",
      "fixtures/review-round/valid/review-round-receipt.json",
      "fixtures/target-repo/valid-init/agent-standards/enforcement-audit.tsv",
      "fixtures/target-repo/valid-observability/agent-standards/enforcement-audit.tsv",
      "fixtures/target-repo/valid-product-cohesion/agent-standards/enforcement-audit.tsv",
      "fixtures/valid/minimal-goal-run.json",
      "fixtures/valid/non-product-engineering-language.json",
      "fixtures/valid/non-product-feature-completion.json",
      "fixtures/valid/proof-surface-negative-probe.json",
      "fixtures/valid/two-lane-ready-dependency.json",
      "plugin-manifest-draft.json",
      "schemas/cli-control-plane-receipt.schema.json",
      "schemas/codex-registry-exposure.schema.json",
      "schemas/common-defs.schema.json",
      "schemas/documentation-freshness-receipt.schema.json",
      "schemas/final-packet-proof.schema.json",
      "schemas/foundational-law-traceability.schema.json",
      "schemas/law-family-aliases.schema.json",
      "schemas/namespace-class-registry.schema.json",
      "schemas/plugin-product-journey-receipt.schema.json",
      "schemas/product-live-surface-receipt.schema.json",
      "schemas/red-fixtures-catalog.schema.json",
      "schemas/red-packet.schema.json",
      "schemas/review-round-receipt.schema.json",
      "schemas/runtime-tool-identity-receipt.schema.json",
      "schemas/schema-catalog.json",
      "schemas/session-log-hardening-receipt.schema.json",
      "schemas/standards-gardening-receipt.schema.json",
      "schemas/transcript-quality-receipt.schema.json",
      "schemas/validator-receipt.schema.json",
      "scripts/check",
      "scripts/check-agent-standards",
      "scripts/check-coverage-fast",
      "scripts/check-coverage-full",
      "templates/PRODUCT_FITNESS_RECEIPT.json",
      "templates/RED_FIXTURES.json",
      "templates/agent-standards/enforcement-audit.tsv",
      "templates/agent-standards/enforcement.json",
      "templates/agent-standards/enforcement.tsv",
      "validator/src/archive/mod.rs",
      "validator/src/audit/agent/standards/enforcement.rs",
      "validator/src/audit/agent/standards/tsv/checks.rs",
      "validator/src/audit/agent/standards/tsv/mod.rs",
      "validator/src/audit/cli/control_plane/authority/mod.rs",
      "validator/src/audit/cli/performance.rs",
      "validator/src/audit/coverage/scope/mod.rs",
      "validator/src/audit/final_packet/mod.rs",
      "validator/src/audit/final_packet/references/coverage.rs",
      "validator/src/audit/final_packet/references/mod.rs",
      "validator/src/audit/final_packet/references/package.rs",
      "validator/src/audit/final_packet/references/source_audit.rs",
      "validator/src/audit/foundational_law_trace.rs",
      "validator/src/audit/law/family/aliases.rs",
      "validator/src/audit/law/family/mod.rs",
      "validator/src/audit/law/mod.rs",
      "validator/src/audit/law/surface/receipt/requirements.rs",
      "validator/src/audit/mandatory/law/surfaces/dependencies.rs",
      "validator/src/audit/mandatory/law/surfaces/mod.rs",
      "validator/src/audit/mod.rs",
      "validator/src/audit/namespace/classes.rs",
      "validator/src/audit/namespace/law/mod.rs",
      "validator/src/audit/namespace/mod.rs",
      "validator/src/audit/namespace/source/mod.rs",
      "validator/src/audit/namespace/source/topology.rs",
      "validator/src/audit/package/checks.rs",
      "validator/src/audit/package/schema/map.rs",
      "validator/src/audit/plugin/laws.rs",
      "validator/src/audit/plugin/product/journey.rs",
      "validator/src/audit/plugin/registry/guard.rs",
      "validator/src/audit/plugin/registry/live/mod.rs",
      "validator/src/audit/plugin/registry/mod.rs",
      "validator/src/audit/product/fitness/mod.rs",
      "validator/src/audit/product/fitness/receipt/mod.rs",
      "validator/src/audit/receipt/mod.rs",
      "validator/src/audit/session/log/hardening/mod.rs",
      "validator/src/audit/session/log/hardening/requirements.rs",
      "validator/src/audit/session/log/mod.rs",
      "validator/src/audit/session/mod.rs",
      "validator/src/audit/source_obligations.rs",
      "validator/src/audit/standards_gardening.rs",
      "validator/src/audit/text_guards/mod.rs",
      "validator/src/bin/ultragoal-validator.rs",
      "validator/src/bin/ultragoal.rs",
      "validator/src/claim/language/mod.rs",
      "validator/src/claim_semantics/claim/proof/mod.rs",
      "validator/src/claim_semantics/coverage/digests.rs",
      "validator/src/claim_semantics/coverage/receipt/authority/mod.rs",
      "validator/src/claim_semantics/plugin_policy/mod.rs",
      "validator/src/cli/control/plane/emit.rs",
      "validator/src/cli/control/plane/evidence/item.rs",